ViLa-MIL-main/experiment_outputs/stage_results/results_stage44/stage44_hcrc_a01_b8_s1/result.csv

metric,test_auc,test_f1,test_acc,val_auc,balanced_acc,sensitivity,specificity,pr_auc
mean,0.968305798428224,0.9109518803833693,0.9194166978259709,0.9647907340534264,0.912665010220907,0.8912256897331524,0.9341043307086615,0.9350723049787171
std,0.016391850958857125,0.01775588516867881,0.016517524629200794,0.01545877145601236,0.014346010733080929,0.017735071454585197,0.024544410358697966,0.031320379536336325

ViLa-MIL-main/results_stage44/stage44_hcrc_light_summary/stage44_hcrc_light_report.md

### hcrc_a01_b8

- status: `ok`
- checkpoints: `5`
- traceback: `False`
- NaN/Inf in log: `False`
- missing folds: `none`
- alpha_init: `0.1`
- bbox_expand: `8.0`
- test_auc: `0.9683 +/- 0.0164`
- test_acc: `0.9194 +/- 0.0165`
- test_f1: `0.9110 +/- 0.0178`
- balanced_acc: `0.9127 +/- 0.0143`
- sensitivity: `0.8912 +/- 0.0177`
- specificity: `0.9341 +/- 0.0245`
- pr_auc: `0.9351 +/- 0.0313`
- val_auc: `0.9648 +/- 0.0155`